course_id,course_title,is_paid,price,num_subscribers,num_reviews,num_lectures,level,content_duration,published_timestamp,subject,language,rating
304426,Bank Reconciliation & VAT on Excel,Paid,20,30,5,19,All Levels,1.5,2014-09-22,Business Finance,English,4.6
581598,Commodity Futures Day Trading Strategies,Paid,95,91,5,28,All Levels,5.0,2015-08-28,Business Finance,English,3.5
328842,Learn to invest in the Stock Market,Paid,40,28,5,14,Beginner,1.0,2014-11-12,Business Finance,English,4.234613666815543
541824,FX Commodity Chart Trading Patterns for Success,Paid,50,83,10,15,All Levels,2.5,2015-07-19,Business Finance,English,4.4
103144,Forex Elite Trading,Paid,85,623,7,22,All Levels,6.0,2013-10-18,Business Finance,English,3.3
937150,How to Invest in Startups - Expert Reveals Winning Secrets.,Free,0,1625,5,145,All Levels,8.5,2016-08-29,Business Finance,English,4.4
1215926,Kickstarter success in 5 easy steps,Paid,20,0,0,12,All Levels,0.5166666666666666,2017-05-16,Business Finance,English,4.234613666815543
1035638,Understanding Financial Statements,Paid,25,0,0,10,All Levels,1.0,2016-12-15,Business Finance,English,4.4
1249146,Planning and Executing a Financial Statement Audit,Paid,50,0,0,9,Intermediate,2.0,2017-06-29,Business Finance,English,3.5
1233894,The Latest Updates 2016 Financial Accounting Standards Board,Paid,50,1,0,9,Intermediate,2.0,2017-06-29,Business Finance,English,4.234613666815543
975910,How to achieve personal transformation,Paid,20,0,0,10,All Levels,0.5333333333333333,2016-12-22,Business Finance,English,4.234613666815543
1221942,Basic Bookkeeping,Paid,35,0,0,12,Beginner,0.7333333333333333,2017-05-23,Business Finance,English,4.5
1169196,"Credit concepts and checklist for bankers, credit analyst",Paid,20,0,0,10,Beginner,2.5,2017-04-24,Business Finance,English,4.234613666815543
1271182,Practical Film Financing: Finding & Pitching Investors,Paid,100,0,0,9,Beginner,1.0,2017-07-05,Business Finance,English,4.234613666815543
1233302,Ratio Analysis for Financial Statements,Paid,50,0,0,6,Beginner,2.0,2017-07-03,Business Finance,English,4.234613666815543
1231958,60 Minutes to Fundamental Accounting Skills,Paid,75,0,0,9,Beginner,2.5,2017-06-28,Business Finance,English,4.6
42645,"Backspreads, Diagonals and Butterflies - Advanced Strategies",Paid,60,737,41,10,Expert,2.0,2013-03-03,Business Finance,English,4.3
355622,Trade Forex 13 Patterns - Golden Ratios Secret Revealed,Paid,200,554,63,44,All Levels,4.0,2015-01-10,Business Finance,English,4.2
514036,Crystal ball trading - foresee price with seasonal patterns,Paid,145,807,19,23,All Levels,6.0,2015-06-14,Business Finance,English,4.234613666815543
45136,Weekly Options and study of Options expiration dynamics,Paid,60,779,56,6,Expert,1.0,2013-03-08,Business Finance,English,4.5
371574,Cost Accounting Basics (Professional Course Level),Paid,20,1777,11,23,Beginner,1.0,2014-12-17,Business Finance,English,4.234613666815543
915964,Learn to Reliably Invest In The Stock Market,Paid,50,841,14,19,All Levels,0.6166666666666667,2016-07-29,Business Finance,English,4.234613666815543
1209556,Hedge Fund Trading Systems Part Two - Stocks & ETFs,Paid,200,56,10,23,Expert,2.5,2017-05-16,Business Finance,English,4.234613666815543
412856,Stock Market Option Trading: How Sell Options For Premium,Paid,200,1909,8,19,Intermediate,2.0,2015-02-08,Business Finance,English,3.9
42651,Straddles and Strangles - Volatility moves in any direction,Paid,60,775,54,11,Expert,1.5,2013-03-12,Business Finance,English,4.1
294914,Debt Collection Management: Get Paid On Time EVERY TIME!,Paid,20,1255,8,38,All Levels,3.0,2015-01-27,Business Finance,English,4.234613666815543
219306,Learn about it,Paid,20,1193,24,27,All Levels,1.5,2014-06-05,Business Finance,English,4.234613666815543
652768,Trading: Basics of Trading for Beginners,Paid,140,1309,4,20,Beginner,1.5,2015-11-11,Business Finance,English,4.234613666815543
42197,Options Spreads Bundle-  the heart of Options Trading,Paid,120,623,43,8,Intermediate,2.5,2013-02-19,Business Finance,English,4.6
936298,Trade the News in Forex: EA Robot Included,Paid,200,276,11,11,All Levels,0.5666666666666667,2016-08-30,Business Finance,English,4.234613666815543
885443,Investment Portfolio Analysis with R,Paid,50,314,38,37,All Levels,6.5,2016-06-27,Business Finance,English,4.234613666815543
585208,Basics of Economics For Beginners A to Z - A Complete Course,Paid,170,1942,5,24,Beginner,1.5,2015-08-24,Business Finance,English,4.234613666815543
386922,Seeing the Big Picture: Understanding Financial Statements,Paid,50,885,69,14,All Levels,0.7166666666666667,2015-01-07,Business Finance,English,4.5
1023650,Financial Modeling for Professionals in 1 Day!,Paid,200,226,12,29,Intermediate,4.5,2016-12-05,Business Finance,English,3.8
676764,Create Your Own Automated Stock Trading Robot In EXCEL!,Paid,150,461,45,44,All Levels,5.0,2015-12-09,Business Finance,English,3.5
696342,FOREX: From Zero To Hero,Paid,150,152,27,26,All Levels,3.0,2017-02-07,Business Finance,Dutch,4.234613666815543
41145,Learn Call Options and Put Options - Introduction to Options,Paid,60,1017,74,20,Beginner,3.0,2013-02-15,Business Finance,English,4.3
145220,1. Principles of Simple Interest ,Paid,20,1074,6,13,All Levels,1.0,2014-01-13,Business Finance,English,4.5
868686,Double Entry Bookkeeping,Paid,50,440,17,10,Beginner,1.0,2016-06-15,Business Finance,English,3.6
745110,MQL5 Tutorial Bootcamp,Paid,20,978,7,13,Beginner,0.5333333333333333,2016-01-29,Business Finance,English,4.234613666815543
745832,Succeed at Options Even If You Don't Know Where to Start,Paid,200,36,1,12,All Levels,1.5,2017-04-17,Business Finance,English,4.2
43778,"Buying, Selling, and Storing Precious Metal",Paid,20,74,1,14,All Levels,1.0,2013-02-27,Business Finance,English,4.234613666815543
19653,Accounting Skills for Managers,Paid,20,78,3,10,Beginner,1.5,2012-06-27,Business Finance,English,4.234613666815543
1013190,Analysis and Evaluation of Economic Feasibility of Projects,Paid,100,10,1,8,Intermediate,1.0,2016-12-19,Business Finance,English,3.2
824034,Technical Analysis: Understanding Price Action,Paid,45,39,6,37,All Levels,3.0,2016-08-26,Business Finance,English,3.8
370440,Bitcoin For Beginners,Paid,50,37,3,22,Beginner,4.0,2014-12-29,Business Finance,German,4.234613666815543
312860,"IAS 16-Property,Plant and Equipment ",Free,0,2166,38,20,All Levels,3.0,2014-10-06,Business Finance,English,4.234613666815543
168358,Basel II,Paid,50,78,6,57,All Levels,3.5,2014-03-06,Business Finance,English,3.8
721746,Forex Trading Plan,Paid,50,21,3,24,All Levels,0.7,2016-02-13,Business Finance,English,3.2
885342,Financial Modeling 101,Free,0,1086,37,5,Beginner,0.6166666666666667,2016-12-19,Business Finance,Italian,4.234613666815543
811416,Learn Financial Modeling from Scratch - Part1,Paid,50,7,4,29,All Levels,3.5,2016-04-06,Business Finance,English,4.3
35131,Introduction to Small Business Accounting Training Tutorial,Paid,25,168,9,75,Beginner,3.5,2013-01-09,Business Finance,English,4.2
570844,Learn Basic Concepts of Economics Step by Step - Complete,Paid,150,2801,6,25,All Levels,1.5,2015-08-16,Business Finance,English,4.234613666815543
189996,Introduction to Digital Payments ,Free,0,12217,351,17,Beginner,1.0,2014-04-29,Business Finance,English,4.234613666815543
716828,The Beginner's Guide to the Futures and Options Trading,Free,0,6185,138,20,All Levels,3.0,2016-01-18,Business Finance,English,4.0
702138,Bitcoin Investing: The Complete Buy & Hold Strategy,Paid,25,477,70,41,All Levels,4.0,2016-01-10,Business Finance,English,4.234613666815543
130298,Financial Modeling in Excel for Startups,Paid,50,1334,86,54,Beginner,6.0,2014-01-05,Business Finance,English,4.3
709536,Learn to Trade Forex Naked Price Action Big Shadow Trade,Free,0,5407,192,11,Intermediate,1.0,2016-01-25,Business Finance,English,4.234613666815543
706942,Forex Trading For Beginners ,Free,0,9483,183,22,Beginner,2.0,2016-01-14,Business Finance,English,4.3
297762,Build a Trading Comps Valuation Model,Paid,50,1032,60,55,All Levels,7.0,2014-10-01,Business Finance,English,4.5
614472,The Advanced Forex Course for Smart Traders,Free,0,8236,144,25,All Levels,5.0,2015-10-09,Business Finance,English,3.9
463834,Cost Accounting Overheads (Professional Course Level),Paid,20,2383,6,19,All Levels,2.5,2015-03-31,Business Finance,English,4.234613666815543
934614,Beginners Guide to Stock Market Investing,Free,0,3283,109,42,Beginner,2.5,2016-09-15,Business Finance,Swedish,4.234613666815543
430968,Financial Management Capital Market Instruments,Paid,25,2650,5,17,Beginner,1.0,2015-02-24,Business Finance,Catalan,4.234613666815543
305368,NPV and IRR Techniques for CA / CFA / CPA Exams,Paid,20,1551,5,55,Beginner,7.5,2014-09-22,Business Finance,English,4.234613666815543
179446,Commercial Credit Analysis,Paid,50,545,48,42,All Levels,7.5,2014-03-12,Business Finance,English,4.6
443502,Essential Finance For Managers,Paid,25,663,10,79,All Levels,5.5,2015-04-16,Business Finance,English,4.2
414246,Bitcoin for Accountants,Free,0,3519,102,6,Beginner,1.0,2015-02-06,Business Finance,English,4.234613666815543
571506,ProTrader -  Advanced Technical Analysis,Paid,125,825,11,34,All Levels,2.0,2016-08-22,Business Finance,English,3.6
1101382,Binary Options Masterclass,Paid,200,70,11,16,All Levels,2.0,2017-02-13,Business Finance,English,4.234613666815543
638966,188% Profit in 1Year - Forex ALGO Robot Trading no indicator,Paid,120,357,71,20,All Levels,2.0,2016-05-03,Business Finance,English,3.7
757508,"Financial Accounting, its Cycle, Statements & Analysis",Paid,20,853,4,35,Beginner,5.0,2016-03-08,Business Finance,English,3.6
180384,Yield Curve Dynamics,Paid,50,397,24,19,All Levels,3.0,2014-03-12,Business Finance,English,4.7
812798,Value Investing and Stock Market Fundamentals,Paid,195,74,8,17,Beginner,3.0,2016-04-07,Business Finance,English,3.4
364206,Media Training for Financial Service Professionals,Paid,20,1254,2,64,All Levels,7.0,2014-12-11,Business Finance,English,4.4
742142,Learn the Forex Naked Price Action Pogo Trade,Paid,60,89,4,10,Intermediate,1.0,2016-02-10,Business Finance,English,4.234613666815543
895030,Forex - Price action Reversal Strategy,Paid,20,38,6,16,All Levels,1.0,2016-07-04,Business Finance,English,4.6
516168,Budget preparation for an EU project proposal,Paid,50,18,4,5,Intermediate,1.0,2015-06-01,Business Finance,English,4.5
612528,Corporate Finance and Alternative Investment for CFA L1,Paid,20,103,3,27,All Levels,4.5,2015-09-17,Business Finance,English,4.1
597084,Don't Let Your Customers Run Your Business,Paid,50,7,3,28,Intermediate,2.5,2015-10-26,Business Finance,French,4.234613666815543
544556,Stock Trading: Insider Tips For Determining Market Direction,Paid,95,104,1,11,All Levels,1.0,2015-07-07,Business Finance,English,3.4
953490,TopTrader Academy - Complete Options Course,Paid,150,42,1,11,All Levels,3.0,2016-09-13,Business Finance,English,4.4
221872,Working Capital Management for Entrepreneurs,Paid,20,507,5,15,Expert,1.0,2014-11-19,Business Finance,English,3.6
662318,Learn Quickbooks to maintain books properly,Paid,20,241,5,26,Beginner,2.5,2015-11-09,Business Finance,English,4.234613666815543
73044,CFA Level I Foundation: Introduction to Financial Reporting,Paid,50,226,5,13,Beginner,5.5,2013-08-05,Business Finance,English,4.234613666815543
714188,"Fixed Income Valuation and Analysis, CFA L2",Paid,20,50,6,12,All Levels,3.0,2016-01-04,Business Finance,English,4.2
548044,Corporation Tax Returns UK,Paid,50,100,23,25,All Levels,2.0,2015-07-23,Business Finance,English,3.8
498360,Trading For Busy People,Paid,50,99,12,26,All Levels,3.0,2015-07-06,Business Finance,English,4.0
425338,Basics of Trading,Paid,40,99,17,27,Beginner,1.0,2015-04-06,Business Finance,English,4.234613666815543
164102,CFP - Introduction to Financial Planning,Paid,30,1192,12,38,Beginner,12.0,2014-02-21,Business Finance,English,4.234613666815543
902888,Investment Portfolio Analysis with Python,Paid,50,209,13,37,All Levels,7.0,2016-07-13,Business Finance,English,4.234613666815543
245822,Day Trading Market Structure Signals,Free,0,5529,90,5,All Levels,2.0,2014-06-18,Business Finance,English,4.234613666815543
729128,Professional Bookkeeping and Accounting 3: Double Entry ,Paid,35,81,8,33,All Levels,1.0,2016-01-21,Business Finance,English,4.2
773650,"Accounting Basics by Hector Garcia, CPA",Free,0,1924,120,5,Beginner,1.0,2016-02-25,Business Finance,English,4.234613666815543
466632,Stock Markets: How I Became Rich By Changing How I Trade,Paid,20,646,6,17,All Levels,1.0,2015-09-13,Business Finance,English,4.0
466774,Learn About Bitcoin and Bitcoin Mining,Paid,20,520,10,9,Beginner,0.5333333333333333,2015-05-01,Business Finance,English,2.7
442114,Take Control By Learning The Stock Market Now,Paid,30,1440,0,21,Beginner,1.0,2015-03-10,Business Finance,English,4.234613666815543
781954,Cost Accounting and Financial Management - A Complete Study,Paid,150,452,14,444,All Levels,45.0,2016-03-04,Business Finance,English,4.4
902150,Learn Global Macro Trading & Investing for Retail Investor,Paid,75,178,16,27,All Levels,1.5,2016-07-15,Business Finance,English,3.2
1169188,Energiespar-Formel // Mehr Geld durch Wasser sparen Zuhause,Paid,50,21,2,54,All Levels,1.5,2017-04-14,Business Finance,German,4.234613666815543
1201912,high swing - كورس لتعليم جميع مراحل احتراف تداول الفوركس,Paid,100,12,4,17,Intermediate,2.5,2017-05-17,Business Finance,Arabic,3.0
167316,TRADER BOT: Introdução à Linguagem MQL5,Paid,20,209,33,33,All Levels,70.0,2014-03-07,Business Finance,Portuguese,3.9
1028656,财务分析与估值建模入门,Free,0,505,43,10,Beginner,1.5,2016-12-03,Business Finance,Chinese,4.8
645890,Aprende desde cero a operar el mercado de divisas FOREX,Paid,90,16,4,24,All Levels,4.0,2015-10-23,Business Finance,Spanish,4.234613666815543
559328,Cómo usar Metatrader 4 para hacer trading?,Paid,20,25,1,25,All Levels,6.0,2015-07-30,Business Finance,Spanish,3.9
1225194,Zoho Books Gestion Financière d'Entreprise pas à pas,Free,0,229,0,33,All Levels,2.0,2017-05-26,Business Finance,French,4.0
734280,Aprende a llevar la contabilidad de forma informatizada,Paid,25,6,1,27,Beginner,4.5,2016-02-08,Business Finance,Spanish,4.0
1164568,Psicología del trading,Paid,20,1,1,6,All Levels,0.6,2017-05-04,Business Finance,Spanish,4.234613666815543
43291,La costruzione del budget di una proposta comunitaria,Paid,50,10,1,5,Intermediate,1.0,2015-01-30,Business Finance,Italian,4.234613666815543
1034560,"Erfolgreich als Signalgeber/in, per Social- und Copytrading",Paid,60,1,1,33,All Levels,6.0,2016-12-13,Business Finance,German,4.234613666815543
871682,Aprenda  a Investir,Paid,20,34,4,9,All Levels,8.0,2016-06-30,Business Finance,Portuguese,4.234613666815543
1057040,Teeter-Totter Accounting,Paid,90,0,0,12,Beginner,1.0,2017-02-08,Business Finance,English,4.234613666815543
1032648,beginning accounting,Paid,20,0,0,12,Intermediate,0.6333333333333333,2016-12-26,Business Finance,English,4.234613666815543
1087466,Stop Creditors from Harassing you and Avoid Bankruptcy,Paid,20,0,0,7,Beginner,0.6166666666666667,2017-02-02,Business Finance,English,4.234613666815543
1058852,Learn to trade using technical analysis,Paid,50,0,0,6,Intermediate,0.5333333333333333,2017-05-02,Business Finance,English,4.234613666815543
1083744,How to Invest Using ETFs from Former Wall Street Trader,Paid,200,0,0,10,All Levels,2.0,2017-02-15,Business Finance,English,4.234613666815543
1271430,Workshop on Banking Credit Analysis Process,Paid,100,0,0,7,All Levels,1.5,2017-06-28,Business Finance,English,4.234613666815543
715476,The Cuckoo Strategy to get European Funding,Paid,160,0,0,6,All Levels,1.0,2016-01-06,Business Finance,English,4.234613666815543
1219820,Accounting - The 6 most important rules you must learn,Paid,20,0,0,9,All Levels,1.0,2017-05-25,Business Finance,English,4.2
627332,Mutual Funds for Investors in Retirement Accounts,Paid,20,0,0,0,All Levels,0.0,2015-12-17,Business Finance,English,4.234613666815543
1136038,Free Ways to Create Passive Income Online,Paid,25,0,0,27,Beginner,1.0,2017-04-17,Business Finance,English,4.234613666815543
1232282,The Cash Flow Statement - An Introduction,Paid,50,0,0,10,Beginner,1.5,2017-06-28,Business Finance,English,4.2
41961,"Options Foundation - Time Decay, Implied Volatility, Greeks",Paid,60,459,25,14,Beginner,3.0,2013-02-17,Business Finance,English,4.2
42040,Buying Call and Put Options - Options beginner strategies,Paid,60,266,20,14,Intermediate,3.0,2013-02-18,Business Finance,English,4.5
1039442,How To Trade RSI Pullback Strategy: Entry To Exit (Forex),Paid,150,104,10,21,All Levels,2.0,2017-02-17,Business Finance,English,4.4
615602,Valuation of Goodwill for CA / CFA / CMA Exams,Paid,20,1509,0,9,All Levels,0.7166666666666667,2015-09-23,Business Finance,English,4.234613666815543
235112,Forex - Catch the Big Market Moves in Forex,Paid,20,212,25,14,Intermediate,1.5,2014-06-02,Business Finance,English,4.234613666815543
551910,SEASON 2 MQL4 Tutorial Bootcamp - Metatrader4 Trading Robots,Paid,25,462,18,34,All Levels,1.0,2015-07-16,Business Finance,English,4.234613666815543
1051430,Intermediate Accounting 1: Easy. Fast. Simple!,Paid,200,90,12,35,Intermediate,2.5,2016-12-29,Business Finance,English,4.6
828596,Global Macro Investing - Take Control Of The World's Markets,Paid,30,153,41,27,Intermediate,2.0,2016-05-16,Business Finance,English,4.234613666815543
258894,How to Read a Balance Sheet,Paid,50,1055,21,64,Beginner,3.5,2014-07-11,Business Finance,English,4.234613666815543
138560,Credit Repair from a Financial Institution,Paid,20,157,13,9,All Levels,2.5,2014-01-14,Business Finance,English,4.234613666815543
689868,The Binary Institute -  Binary Options Trading Course,Paid,200,103,25,12,All Levels,2.5,2015-12-14,Business Finance,English,4.5
1020244,Mental Models For Wall Street - Become A Better Trader,Free,0,1067,50,35,All Levels,2.0,2016-12-14,Business Finance,English,4.6
858764,株式投資に向く性格に変えるための心理学を学ぶ,Paid,20,58,11,28,All Levels,1.5,2016-06-14,Business Finance,Japanese,4.2
941310,Matemática Financeira com HP12C e MS Excel,Paid,20,74,17,30,Beginner,4.5,2016-10-12,Business Finance,Portuguese,4.7
1214144,¡Triunfar en La Bolsa de Valores No Requiere de Experiencia!,Free,0,338,7,6,Beginner,1.0,2017-05-30,Business Finance,Spanish,3.8
492344,Cómo Crear Políticas Contables bajo NIIF para PYMES,Paid,20,27,5,6,All Levels,1.0,2015-08-25,Business Finance,Spanish,4.0
815672,Finanzas Personales para Vivir Libre de Deudas,Paid,75,76,13,77,Beginner,6.0,2016-04-27,Business Finance,Spanish,4.4
376712,Finanzas personales: Logrando la Libertad Financiera,Paid,30,27,5,12,Beginner,2.0,2015-01-09,Business Finance,Spanish,4.234613666815543
869716,株式投資で本当のテクニカル分析ができるようになる,Paid,20,68,10,45,Intermediate,2.5,2016-07-01,Business Finance,Japanese,4.5
754156,Aktiver Vermögensaufbau mit ETF,Paid,20,112,18,33,Beginner,2.0,2016-02-22,Business Finance,German,4.234613666815543
709816,Socorro! Preciso Organizar as Minhas Finanças!,Paid,20,72,17,37,All Levels,1.5,2016-01-08,Business Finance,Portuguese,4.234613666815543
680046,Curso Completo de Opciones Binarias: Estrategias 90% Acierto,Paid,145,335,16,26,All Levels,1.5,2015-12-16,Business Finance,Spanish,3.3
1138162,Le basi del Trading,Paid,200,22,5,18,All Levels,3.5,2017-03-11,Business Finance,id,4.234613666815543
829182,【個人事業主向け】青色申告の記帳を自力で行うための複式簿記の基本,Paid,30,41,3,37,Beginner,3.0,2016-05-25,Business Finance,Japanese,4.1
1163242,Profit and Loss Account for bankers and credit analysts,Paid,20,1,0,31,Beginner,7.5,2017-04-23,Business Finance,English,4.234613666815543
46933,Business Accounts For Managers,Paid,30,16,0,23,Beginner,3.0,2013-04-23,Business Finance,English,3.9
954842,Black Scholes Option Pricing Model,Paid,25,3,0,10,Beginner,1.0,2017-05-03,Business Finance,English,3.3
868112,Chief Wealth Officer,Paid,45,4,0,7,Beginner,1.0,2016-06-03,Business Finance,English,4.6
1056242,Practical Accounts Training A,Paid,35,2,0,127,Intermediate,31.5,2017-01-18,Business Finance,English,4.3
113712,International Trade and New Geographic Economy,Paid,20,12,1,6,All Levels,0.5333333333333333,2013-12-05,Business Finance,English,4.234613666815543
146454,2. Principles of Simple Interest - advanced problems,Paid,20,10,1,12,Intermediate,1.5,2014-01-20,Business Finance,English,4.234613666815543
56926,School of Raising Capital: Agile Financial Modeling,Paid,20,12,1,11,All Levels,1.5,2013-06-28,Business Finance,English,4.234613666815543
589778,How to Read Financial Statements,Paid,20,5,2,59,Beginner,2.0,2015-08-23,Business Finance,English,4.234613666815543
1113702,"Intro. to Asset-Backed Securities, CFA Level I,  2017 Prep",Paid,20,1,0,13,All Levels,3.0,2017-03-27,Business Finance,English,4.234613666815543
1072220,Reach Your Personal Financial Goals the Easy Way (2017 UK),Paid,95,2,0,59,All Levels,4.5,2017-05-22,Business Finance,English,4.4
101038,Bitesize Bookkeeping for busy people,Paid,20,9,0,13,Beginner,1.5,2015-03-29,Business Finance,English,4.234613666815543
417088,Do Your Own Accounts,Paid,35,42,2,13,All Levels,1.5,2015-02-13,Business Finance,English,3.9
258954,CFA Level 1 - Derivatives,Paid,30,110,6,25,All Levels,4.0,2014-07-21,Business Finance,English,4.3
298044,Accounting for everyone! ,Paid,35,420,2,14,Beginner,1.0,2014-11-19,Business Finance,English,4.234613666815543
593962,Stock Fundamental Analysis with Excel,Paid,50,206,13,50,All Levels,10.0,2015-09-15,Business Finance,English,4.234613666815543
941520,Financial Accounting For Beginners,Paid,60,164,3,22,All Levels,1.5,2016-09-25,Business Finance,English,3.8
64173,Trading: How Transformative Learning Drives Expertise,Paid,30,69,2,16,All Levels,1.0,2013-07-15,Business Finance,English,4.234613666815543
371828,Manual Bookkeeping,Paid,20,28,2,26,Intermediate,2.5,2015-07-24,Business Finance,English,3.8
974954,Numeracy skills in business and everyday life:Think and Deal,Paid,20,90,4,15,Beginner,0.6333333333333333,2016-10-11,Business Finance,English,4.234613666815543
818572,Financial Modelling in Excel Step by Step,Paid,20,13,2,17,Intermediate,1.5,2016-05-05,Business Finance,English,3.6
115752,Straight From Business School: Create Financial Statements,Paid,20,31,2,5,Beginner,1.0,2013-11-28,Business Finance,English,4.0
731150,How To Pay Less Tax (UK version),Paid,50,13,2,98,All Levels,0.5166666666666666,2016-01-19,Business Finance,English,4.234613666815543
627772,Interpreting financial statements,Free,0,2119,111,54,All Levels,2.0,2015-10-28,Business Finance,English,4.0
850726,Forex trading with binary options,Paid,25,136,28,21,All Levels,3.0,2016-05-16,Business Finance,English,4.234613666815543
136244,Triple P Trading Course,Paid,20,797,15,16,All Levels,3.0,2013-12-24,Business Finance,English,4.3
485889,Cost Accounting - A Comprehensive Study,Paid,180,503,43,286,All Levels,29.5,2015-04-26,Business Finance,English,4.1
507778,How to become a successful day trader,Paid,95,1150,6,27,All Levels,2.5,2015-05-25,Business Finance,English,4.1
422918,Essentials of Finance and Investment in 2 hours,Paid,20,1403,6,14,Beginner,2.0,2015-06-01,Business Finance,English,3.6
362530,Public Speaking: You Can Give Great Financial Presentations,Paid,20,916,6,23,All Levels,6.5,2014-12-11,Business Finance,English,4.6
579642,Professional Trading - Consistent Profits with Low Risk!,Paid,20,627,5,27,All Levels,1.0,2015-10-17,Business Finance,English,3.6
1022796,Trading for winning,Paid,200,168,7,27,All Levels,2.0,2017-01-23,Business Finance,English,4.7
793084,Succeed in Stocks Even if you Don't Know Where to Start,Free,0,2554,20,10,Beginner,1.0,2017-03-09,Business Finance,English,3.9
881062,Options Basics & Trading With Small Capital! - Level 1,Paid,30,120,17,19,Beginner,2.0,2016-07-26,Business Finance,English,4.3
838260,Forex trading Basic to advance Professional Level course,Paid,20,750,13,28,All Levels,2.5,2016-05-05,Business Finance,English,4.234613666815543
380542,Day Trading in Stocks: Strategies for Beginner Investors,Paid,50,217,19,9,All Levels,2.0,2015-01-08,Business Finance,English,3.6
772480,Learn to Trade Forex Big U-Turn Trade,Paid,50,106,13,12,Beginner,1.0,2016-02-24,Business Finance,English,4.234613666815543
576906,"Technical Analysis Primer for trading Stocks, Bonds & Forex",Paid,50,397,4,36,Beginner,3.0,2015-11-23,Business Finance,English,4.5
410196,DIY: Reduce Unpaid Federal Tax thru  IRS Offer in Compromise,Paid,20,44,3,8,All Levels,1.0,2015-03-26,Business Finance,English,4.234613666815543
581662,Stock Trading with this Strategy,Paid,50,30,3,6,All Levels,1.0,2015-08-13,Business Finance,English,3.7
1088102,The Psychology of Trading,Paid,20,95,3,20,All Levels,1.0,2017-02-02,Business Finance,English,2.9
788756,Professional Forex Strategy+2 weeks for FREE trading alerts,Paid,95,55,9,15,All Levels,1.0,2016-03-29,Business Finance,English,4.234613666815543
380206,Stock Trading Essentials for Day Traders,Paid,100,94,15,9,All Levels,1.0,2015-01-08,Business Finance,English,3.4
160322,Basics of Finance and Budgeting,Paid,20,578,7,34,Beginner,6.0,2014-05-19,Business Finance,English,3.4
610812,Portfolio Management CFA L1 2016,Paid,20,393,5,34,All Levels,5.0,2015-09-15,Business Finance,English,4.2
288256,"Trade Stocks, Forex & Financial Markets like a Professional",Paid,20,116,6,12,All Levels,3.0,2014-08-28,Business Finance,English,4.234613666815543
662996,The Tax Advantaged Investor: A Guide to Legal Tax Reduction!,Free,0,1888,42,25,All Levels,2.0,2015-12-17,Business Finance,English,4.0
101234,The Smart Option Trader,Paid,45,412,19,74,All Levels,13.0,2013-10-10,Business Finance,English,3.6
1113442,Beginners Chart Patterns Trading for Penny Stocks,Paid,200,40,7,26,Beginner,1.5,2017-02-22,Business Finance,English,4.4
746366,Financial Statements: Learn Accounting. Unlock the Numbers.,Paid,40,222,12,35,Beginner,3.0,2016-02-17,Business Finance,English,4.5
186556,CFA® Level 1 2014 – Alternative Investments,Paid,30,831,1,13,All Levels,2.0,2014-04-14,Business Finance,English,4.234613666815543
