course_id,course_title,is_paid,price,num_subscribers,num_reviews,num_lectures,level,content_duration,published_timestamp,subject,language,rating
79154,Back to School Web Development and Programming Bundle,Paid,200,18170,117,779,Beginner,44.5,2013-08-19,Web Development,English,4.4
328476,Complete ASP NET MVC Web Development - Newbie to Ninja!,Paid,195,6073,627,66,All Levels,9.0,2014-11-24,Web Development,English,3.8
921474,The Complete DevOps Engineer Course 2.0 - Java & Kubernetes,Paid,195,5335,105,117,All Levels,14.0,2016-08-06,Web Development,English,3.8
82778,All about NodeJS,Paid,50,8755,931,133,All Levels,15.5,2014-12-19,Web Development,English,4.7
907386,How To Create A Wordpress Website 2016 | NEW Divi Theme 3.0!,Paid,40,4144,383,43,Beginner,5.5,2016-10-13,Web Development,English,4.234613666815543
877124,The Complete jQuery Course - From Beginner to Professional!,Paid,200,6420,134,188,All Levels,22.5,2016-06-20,Web Development,English,4.3
1169378,Build a complete Fiverr clone with Node + Algolia + Paypal,Paid,30,1741,26,87,All Levels,9.0,2017-05-20,Web Development,English,4.0
30240,The Ultimate Web Development Course,Paid,50,9881,329,136,All Levels,12.0,2013-08-25,Web Development,English,4.234613666815543
836044,React From The Ground Up,Paid,150,3252,401,62,All Levels,12.5,2016-05-02,Web Development,English,4.0
405818,Javascript for Beginners Learn by Doing Practical Exercises,Paid,100,5089,685,29,All Levels,3.5,2015-01-31,Web Development,English,4.4
665042,8 Beautiful Ruby on Rails Apps in 30 Days & TDD - Immersive ,Paid,100,5962,466,132,All Levels,16.0,2016-03-08,Web Development,English,4.8
1068590,Wordpress Website Mastery 2017,Free,0,5181,64,22,Beginner,2.5,2017-01-18,Web Development,English,3.9
1203894,How To Make an eCommerce Website With Wordpress 2017,Free,0,3493,43,26,Beginner,4.5,2017-05-09,Web Development,English,4.234613666815543
994634,Mastering ASP.NET MVC 5 From Scratch Using C#,Paid,50,417,65,109,All Levels,13.0,2016-12-01,Web Development,English,4.0
765916,Start Web Development with GIS Map in JavaScript,Paid,60,1599,26,49,All Levels,3.0,2016-02-28,Web Development,English,4.234613666815543
128950,Learn to Build Websites using Twitter Bootstrap,Free,0,15134,523,12,All Levels,2.5,2014-04-14,Web Development,English,4.4
549064,Web Development Tools the Pros Use: Code Productivity Hacks,Paid,30,2596,11,39,Beginner,4.0,2015-10-08,Web Development,English,3.7
400280,WordPress : An Overview,Paid,45,1783,16,15,Beginner,0.6,2015-02-02,Web Development,English,4.234613666815543
382856,Create Startup Landing Page with Viral Marketing Strategies,Free,0,12974,120,13,Beginner,1.0,2015-01-03,Web Development,English,4.5
958982,JavaScript : JavaScript Awesomeness,Paid,25,785,20,25,Beginner,1.0,2016-09-15,Web Development,English,4.1
1113036,Mastering CSS 3.0 Selectors,Free,0,4115,63,13,Intermediate,2.0,2017-02-22,Web Development,English,4.7
226534,WordPress Backup And Restore Fundamentals,Free,0,13242,131,24,Intermediate,1.0,2014-06-24,Web Development,English,3.7
738726,Learn HTML and CSS to make a Website,Paid,20,1154,12,71,Beginner,6.0,2016-01-28,Web Development,English,4.234613666815543
64422,1 Hour HTML,Paid,200,16212,514,20,Beginner,1.0,2013-07-09,Web Development,English,4.5
874166,Angular 2 Crash Course with TypeScript,Paid,100,16409,589,74,All Levels,4.0,2016-06-14,Web Development,English,4.8
1197650,Boost your website speed without any coding!,Paid,50,1337,28,12,All Levels,1.0,2017-05-14,Web Development,English,4.4
912946,Professional Rails Code Along,Paid,40,1469,237,120,Intermediate,19.0,2016-08-04,Web Development,English,4.1
876544,ASP.NET Web API 2 Hands-On,Paid,20,2660,276,16,All Levels,1.5,2016-06-19,Web Development,English,4.5
1205894,Create a MEAN App by Example - Full Stack Course,Paid,50,421,26,33,Intermediate,3.5,2017-05-08,Web Development,English,4.4
19332,The Original Complete Web Developer Course.,Paid,20,31070,742,195,Beginner,18.0,2012-10-28,Web Development,English,4.5
863954,Angular 2 From The Ground Up,Paid,30,1737,471,87,All Levels,11.5,2016-06-02,Web Development,English,4.234613666815543
789324,Complete Web Development Course + Building 5 Websites!,Paid,200,11492,174,118,All Levels,24.5,2016-03-21,Web Development,English,4.4
1229274,WP Plugin Development - Build your own plugin!,Paid,200,5439,22,24,Beginner,4.0,2017-06-13,Web Development,English,3.5
906700,Sass: From Beginner to Advanced,Paid,40,8059,231,39,All Levels,2.0,2016-07-21,Web Development,English,4.234613666815543
113706,Build Flat Responsive Website from Scratch - Complete Course,Paid,35,12105,144,54,All Levels,7.5,2013-12-04,Web Development,English,4.234613666815543
604044,Wordpress for Beginners - Build a Live Website from Scratch,Paid,20,3877,92,15,Beginner,1.5,2015-09-09,Web Development,English,4.234613666815543
531290,"Essential JavaScript, jQuery and AngularJS Training",Paid,30,2919,136,70,Intermediate,7.0,2015-07-09,Web Development,English,4.2
436210,The Pro Ruby on Rails Starter,Paid,45,2409,90,19,Beginner,2.5,2015-03-04,Web Development,English,3.9
617158,Unit Testing AngularJS: Build Bugfree Apps That Always Work!,Paid,25,2083,213,23,All Levels,2.5,2016-01-24,Web Development,English,4.5
1121580,WordPress Blog : Create a WordPress Website for Beginners,Paid,20,2076,8,20,Beginner,2.0,2017-02-26,Web Development,English,4.234613666815543
782192,Introduction to HTML5 Canvas basics of drawing,Paid,200,2918,16,17,Beginner,1.0,2016-03-14,Web Development,English,3.9
978728,"Thoughtful Web Development Course: HTML, Vue.js, PHP, MySQL",Paid,200,842,144,536,All Levels,25.0,2016-10-11,Web Development,English,4.6
65493,Kids Coding - Beginners CSS,Paid,100,7130,30,17,All Levels,1.0,2013-07-25,Web Development,English,4.6
32649,PHP & MySQL - Learn The Easy Way. Master PHP & MySQL Quickly,Paid,50,5549,92,143,All Levels,15.5,2012-12-15,Web Development,English,4.1
1225030,Learning Path: Magento: Master and Test Magento 2 with Ease,Paid,200,155,9,37,Expert,6.0,2017-05-26,Web Development,English,4.234613666815543
903140,The Complete hapiJS Course - Go From Beginner To Advanced!,Paid,195,1697,64,54,All Levels,6.0,2016-07-13,Web Development,English,4.234613666815543
372518,Ruby On Rails For Web Development,Paid,195,2526,185,24,Beginner,5.0,2014-12-17,Web Development,English,4.2
1045862,Create eye-catching WordPress website from scratch,Paid,30,2342,15,19,Beginner,4.5,2016-12-28,Web Development,English,4.234613666815543
99826,Become A Web Developer And Seller - Build Websites With HTML,Paid,200,21730,61,35,Beginner,2.5,2013-10-05,Web Development,English,4.234613666815543
1236746,WordPress Tips and Tricks,Paid,200,1117,10,37,Intermediate,2.5,2017-06-08,Web Development,English,4.234613666815543
1110756,HTML Tutorials : HTML Code for Website Creating,Paid,20,2401,15,27,All Levels,3.0,2017-02-22,Web Development,English,4.234613666815543
595728,Complete HTML5 and CSS3 Course +1 Start to Finish Project,Paid,200,3887,81,94,All Levels,8.5,2015-09-07,Web Development,English,3.5
1231872,Web Development With HTML CSS BOOTSTRAP JQUERY for Beginners,Paid,35,1156,4,59,Beginner,5.0,2017-05-30,Web Development,English,3.8
876850,HTML5 Specialist: Comprehensive HTML5 Training,Paid,100,1385,188,83,All Levels,5.0,2016-06-22,Web Development,English,4.5
113518,CSS and CSS3 For Absolute Beginners,Paid,75,10890,212,33,Beginner,5.0,2013-11-01,Web Development,English,4.0
1111552,Build a Complete JQuery Plugin (Image Pop-up Dialog),Paid,20,1126,10,12,All Levels,1.0,2017-02-23,Web Development,English,4.2
834924,How to create HTML Forms,Paid,30,3652,60,7,Beginner,0.6666666666666666,2016-04-29,Web Development,English,3.7
764042,ReactJS and Flux: Learn By Building 10 Projects,Paid,60,1723,258,60,All Levels,11.0,2016-02-18,Web Development,English,3.4
821526,How To Make A Business Website In 1 Day With Wix FAST & EASY,Paid,20,3759,24,25,Beginner,4.0,2016-04-18,Web Development,English,3.7
838418,PHP Date and Time Course by Edwin Diaz,Paid,40,1653,53,14,All Levels,1.5,2016-05-03,Web Development,English,4.8
342084,Start Your Own Forum Website in 15 Minutes ,Paid,40,5387,38,15,All Levels,1.0,2015-01-26,Web Development,English,4.234613666815543
669536,Hit the ground running with AngularJS with Dion Yang,Paid,100,4563,49,13,All Levels,1.5,2015-11-26,Web Development,English,4.234613666815543
511378,Learn CSS Transition and Animation ,Paid,100,3757,28,20,All Levels,1.0,2015-05-27,Web Development,English,4.0
553582,Learn JavaScript from scratch,Paid,20,4193,92,44,Beginner,2.5,2015-07-30,Web Development,English,4.234613666815543
566920,WordPress for Beginners - Tutorial - From Novice to Know-How,Paid,20,3694,48,39,Beginner,4.0,2015-08-28,Web Development,English,4.234613666815543
406820,RESTful API with Laravel,Paid,45,1905,228,57,All Levels,6.0,2015-02-05,Web Development,English,4.5
636418,Learn Ruby on Rails for Absolute Beginners,Paid,195,2875,20,36,All Levels,4.5,2015-10-14,Web Development,English,3.6
986442,JavaScript Tutorial,Paid,180,613,93,37,All Levels,4.5,2016-10-17,Web Development,English,1.4
996320,Shopping Cart Website from Scratch Ecommerce,Paid,200,633,39,54,Beginner,4.0,2016-11-08,Web Development,English,4.1
936182,Learn By Example: Angular JS,Paid,50,1515,32,60,All Levels,7.0,2016-08-22,Web Development,English,4.3
905850,The Complete front end web developer Bootcamp - 14 projects,Paid,200,900,129,126,All Levels,18.5,2016-08-12,Web Development,English,4.7
547298,WordPress LMS: E-Learning Website Made Easy,Paid,20,2382,22,16,All Levels,1.5,2015-07-08,Web Development,English,4.234613666815543
294794,Create An HTML5 Video Player From Scratch,Free,0,32260,1005,12,Beginner,1.5,2014-09-05,Web Development,English,4.234613666815543
615920,In Depth Web Development Made Easy,Paid,25,3249,27,60,All Levels,6.5,2015-10-30,Web Development,English,3.9
955818,Jquery :basics for beginners,Paid,50,1274,34,15,All Levels,0.6666666666666666,2016-09-12,Web Development,English,4.234613666815543
65330,Web Development By Doing: HTML / CSS From Scratch,Free,0,72932,2575,21,Beginner,1.0,2013-09-25,Web Development,English,4.3
173548,Build Your First Website in 1 Week with HTML5 and CSS3,Free,0,120291,5924,30,Beginner,3.0,2014-04-08,Web Development,English,4.7
1183094,"ASP.NET Core MVC, Quick and Practical",Paid,20,387,5,30,Intermediate,2.5,2017-04-25,Web Development,English,4.234613666815543
738360,Better way towards CSS using Less and Sass,Paid,20,2227,44,26,All Levels,1.5,2016-02-16,Web Development,English,3.7
650328,JavaScript Complete for beginners with real world Apps,Paid,120,2652,33,40,All Levels,3.5,2016-02-02,Web Development,English,4.5
69414,Creating a Responsive HTML Email,Paid,20,2520,183,34,All Levels,1.5,2013-08-12,Web Development,English,4.4
500628,Angular 2 Demystified,Paid,20,3150,69,49,All Levels,3.5,2015-05-18,Web Development,English,3.4
384078,Learn HTML Fast and Easy!,Paid,20,4011,24,17,Beginner,1.5,2015-08-03,Web Development,English,4.6
451938,How To Setup a Micro-Blog in 3 Easy Steps,Paid,25,6937,22,7,All Levels,1.0,2015-03-20,Web Development,English,4.234613666815543
657710,Ruby on Rails for Complete Beginners,Paid,35,4839,129,84,Beginner,4.0,2015-11-02,Web Development,English,4.234613666815543
977516,Wordpress for Non-Technical People,Paid,150,2346,10,65,Beginner,4.5,2016-11-15,Web Development,English,4.234613666815543
997750,ASP NET CORE - ANGULAR 2 E-Commerce App,Paid,200,897,129,171,All Levels,13.0,2017-01-13,Web Development,English,3.6
316704,Introductory JavaScript Made Easy Training Tutorial,Paid,20,9381,138,131,Beginner,11.0,2014-10-15,Web Development,English,3.5
106178,Become a Heroku Rails Ninja: Expert Level Deployment Tools,Paid,50,7090,52,30,Intermediate,8.5,2014-02-15,Web Development,Catalan,4.234613666815543
1062686,Complete RESPONSIVE Website Design with HTML5 & CSS3,Paid,20,2204,6,97,Beginner,9.0,2017-02-03,Web Development,English,4.234613666815543
1082996,Pimcore Developer: Implement a Blog from a Bootstrap Theme,Paid,95,1212,15,39,All Levels,4.5,2017-01-24,Web Development,English,4.234613666815543
629044,Inspirational Web Development - A Beginner Approach -,Paid,20,5328,47,28,Beginner,3.5,2016-01-24,Web Development,English,4.234613666815543
476408,"Learn HTML, A practical guide from scratch to HTML 5",Paid,100,5715,52,31,All Levels,3.0,2015-04-26,Web Development,English,4.234613666815543
1124244,JavaScript Tutorial: Learn JavaScript Code for Beginners,Paid,20,2074,14,22,Beginner,1.5,2017-03-08,Web Development,English,4.234613666815543
217010,Website Secrets: Get a Gorgeous Website on the Cheap,Paid,50,12328,15,32,All Levels,2.0,2014-07-04,Web Development,English,4.234613666815543
576694,Ultimate WordPress Plugin Course,Paid,100,4537,415,49,All Levels,9.0,2015-08-20,Web Development,English,4.234613666815543
527952,PHP for Beginners: How to Build an E-Commerce Store,Paid,100,5117,463,138,All Levels,14.5,2015-07-17,Web Development,English,4.7
745306,"Build Realtime Apps | React Js, Golang & RethinkDB",Paid,60,3854,482,48,All Levels,3.0,2016-01-29,Web Development,English,4.3
941998,"Master Electron: Desktop Apps using HTML, JavaScript & CSS",Paid,165,1902,224,47,Intermediate,5.5,2017-03-21,Web Development,English,4.7
674608,The Complete Web Developer Masterclass: Beginner To Advanced,Paid,195,37141,1813,316,All Levels,51.0,2016-05-18,Web Development,English,4.1
1204208,Mastering Micro Services Using Java Spring Boot,Paid,195,1649,34,25,All Levels,2.0,2017-05-17,Web Development,English,4.234613666815543
957422,How to Create A Website: An HTML Tutorial and CSS Tutorial,Paid,65,3012,260,330,All Levels,32.5,2016-09-25,Web Development,English,4.6
511838,The Advanced Web Developer Course,Paid,100,6890,99,90,Intermediate,10.5,2015-06-03,Web Development,English,4.234613666815543
621022,Projects in MongoDB - Learn MongoDB Building Projects,Paid,50,4628,247,93,All Levels,12.0,2015-09-28,Web Development,English,4.5
30318,Learning JavaScript Programming Tutorial. A Definitive Guide,Paid,50,17113,380,93,All Levels,9.5,2012-11-26,Web Development,English,4.5
1270392,"The Complete JavaScript, HTML and CSS Tutorial For Beginners",Paid,35,244,44,21,Beginner,3.0,2017-06-29,Web Development,English,4.234613666815543
991094,"Build Modern Responsive Website With HTML5, CSS3 & Bootstrap",Paid,195,1472,210,110,All Levels,13.0,2017-02-08,Web Development,English,4.2
695656,The Complete JavaScript Course For Web Development Beginners,Paid,195,31499,450,46,All Levels,4.0,2015-12-29,Web Development,English,4.3
1174446,Email Marketing: Send Unlimited Emails via Own Mail Server,Paid,35,3539,43,20,Beginner,1.0,2017-04-19,Web Development,English,4.5
1267892,Getting started with JavaScript,Paid,200,1415,17,23,Beginner,1.5,2017-06-27,Web Development,English,4.1
1149334,Learn the basics of the Web development: Coding Tactics,Paid,40,2965,17,30,Beginner,2.0,2017-04-29,Web Development,English,4.234613666815543
1109150,RESTful API with Laravel 5.4: Definitive Guide,Paid,145,655,95,195,All Levels,12.5,2017-04-28,Web Development,English,4.5
445534,Learn AngularJS Step By Step,Paid,20,18777,1112,21,Intermediate,1.5,2015-07-07,Web Development,English,3.9
987666,Learn React : The World's Most Lucrative JavaScript Library,Paid,50,1591,99,74,Beginner,9.5,2017-02-08,Web Development,English,4.234613666815543
1134330,Master Regular Expressions from scratch - All languages,Paid,70,1925,27,38,All Levels,2.0,2017-04-27,Web Development,English,4.5
983534,Try AngularJS: Beginner's Guide to Front End Web Development,Paid,50,16926,126,33,Beginner,4.5,2016-10-13,Web Development,English,4.8
563248,JavaScript Step by Step how to apply it to your web pages,Paid,100,13406,78,44,All Levels,1.5,2015-07-26,Web Development,English,4.4
1140532,Explore JavaScript Beginners Guide to Coding JavaScript,Paid,200,5739,26,29,Beginner,2.5,2017-03-12,Web Development,English,4.234613666815543
701636,Learn Web Scraping with Node.js,Paid,75,16731,137,10,All Levels,1.0,2015-12-29,Web Development,English,4.0
797832,Getting Started with WordPress 2016,Paid,20,1613,21,20,Beginner,1.0,2016-04-14,Web Development,English,4.234613666815543
41295,Learn HTML5 Programming From Scratch,Free,0,268923,8629,45,All Levels,10.5,2013-02-14,Web Development,English,4.3
413494,Getting Started with LESS - Beginner Crash Course,Paid,25,1780,69,21,Beginner,1.5,2015-02-12,Web Development,English,4.2
911318,Master ECMAScript 2015 (ES6),Free,0,7438,441,37,All Levels,2.5,2016-11-28,Web Development,English,4.7
197828,Learn to Setup Websites from Scratch,Free,0,21087,154,24,Beginner,3.5,2014-04-14,Web Development,English,4.6
576646,Create Fast RESTful APIs with Lumen and Homestead by Laravel,Paid,60,1157,105,31,All Levels,3.0,2015-10-25,Web Development,English,4.234613666815543
984072,"Build Modern Websites Quick With HTML,CSS and Bootstrap",Paid,20,912,17,48,Beginner,4.5,2016-10-18,Web Development,English,4.234613666815543
709180,Twitter Integration customize Tweets with developer API,Paid,115,2039,7,19,All Levels,1.0,2015-12-29,Web Development,English,4.1
188692,Build a Responsive Website with a Modern Flat Design,Free,0,16527,354,17,All Levels,2.0,2014-03-26,Web Development,English,4.234613666815543
683606,The Ultimate WordPress Boot Camp: Build 7 Websites,Paid,125,1000,74,140,Intermediate,11.0,2016-02-26,Web Development,English,4.234613666815543
429364,Master the Basics of HTML5 & CSS3: Beginner Web Development,Free,0,26541,750,38,Beginner,3.0,2015-05-21,Web Development,English,4.5
1012096,Become A Full Stack Web Developer in 14 Days,Paid,195,467,20,126,All Levels,13.5,2016-11-23,Web Development,English,4.3
1016388,Projects In ReactJS - The Complete React Learning Course,Paid,50,947,108,56,Intermediate,8.0,2016-11-22,Web Development,English,4.234613666815543
978852,Beginning Web development Learn the basics of HTML,Paid,95,9832,71,59,Beginner,2.0,2017-01-06,Web Development,English,4.5
1148342,Step by Step Build Your Template by Bootstrap 4 from scratch,Paid,80,2184,15,24,Beginner,3.0,2017-03-30,Web Development,English,4.234613666815543
1199780,Hosting your static website on Amazon AWS S3 service,Paid,20,2853,47,16,Beginner,1.5,2017-05-05,Web Development,English,4.4
648118,JavaScript Rockstar How to create Incredible Useful code,Paid,75,16590,51,27,All Levels,2.5,2015-10-29,Web Development,English,4.0
863812,Spring Core DevOps on AWS,Paid,100,1626,115,78,Intermediate,6.5,2016-11-15,Web Development,English,4.6
752432,How to Create a Website Without Coding - WordPress 2016,Paid,195,9056,96,31,Beginner,1.5,2016-02-04,Web Development,English,4.2
639848,PHP Graphic Techniques: CAPTCHA/ Create a verification code,Paid,20,8320,73,11,All Levels,0.7166666666666667,2015-10-14,Web Development,English,4.234613666815543
942366,Introductory To HTML and CSS,Paid,50,4106,112,15,Beginner,1.0,2016-08-27,Web Development,English,4.234613666815543
1103448,Learn how to convert PSD to HTML and CSS responsive,Paid,30,5324,52,14,All Levels,2.5,2017-02-10,Web Development,English,3.6
945602,PHP User Login Registration Script With All Features,Paid,200,5603,46,47,All Levels,4.0,2016-10-02,Web Development,English,3.5
446608,AJAX : Let's build a COOL project,Paid,70,4183,292,38,All Levels,3.5,2015-03-13,Web Development,English,4.7
866384,Advanced WordPress Topics: Post Types Taxonomies & Metaboxes,Paid,95,301,44,91,Intermediate,7.5,2016-07-10,Web Development,English,3.9
678150,Laravel Homestead,Free,0,3883,110,9,Beginner,1.0,2016-12-07,Web Development,English,4.7
980114,The Complete TypeScript Programming Guide for Web Developers,Paid,40,236,31,35,Intermediate,4.0,2016-10-12,Web Development,English,4.2
17887,JavaScript with BackboneJS and Bootstrap CSS - Advanced,Paid,25,1758,37,16,Intermediate,3.5,2012-05-21,Web Development,English,4.234613666815543
465210,Ruby on Rails Tutorial: Learn 6 Ruby on Rails SEO Techniques,Paid,200,1266,16,21,All Levels,2.0,2015-05-15,Web Development,English,3.7
967422,XML DOM :basics for beginners,Paid,35,920,1,7,All Levels,0.7,2016-09-26,Web Development,Norwegian,4.234613666815543
708558,Learn HTML Basics From Scratch,Free,0,5004,52,21,All Levels,3.0,2015-12-29,Web Development,English,4.234613666815543
783686,Byte-Sized-Chunks: Dynamic Prototypes in Javascript,Paid,20,880,6,24,All Levels,3.0,2016-03-10,Web Development,English,4.234613666815543
551072,Build Websites from Scratch with Squarespace,Paid,50,342,53,60,Beginner,3.5,2015-07-16,Web Development,English,4.0
1004008,Introduction to web programming for GIS applications,Paid,100,205,38,97,Beginner,13.5,2017-03-13,Web Development,English,4.2
344224,Java Spring Security,Paid,40,527,63,11,Intermediate,2.5,2014-11-15,Web Development,English,4.3
235104,Responsive Html5 Theme Development,Paid,20,1517,4,12,All Levels,1.0,2014-06-06,Web Development,English,4.234613666815543
598970,What’s New in Bootstrap 4,Paid,20,130,14,20,All Levels,0.6166666666666667,2015-09-07,Web Development,English,4.4
543346,ReactJS Course: Learn JavaScript Library Used by Facebook&IG,Paid,50,1018,33,41,Intermediate,3.0,2015-07-07,Web Development,English,2.6
575644,Building a Ruby on Rails Application with Neo4j,Free,0,4830,38,7,Intermediate,0.5333333333333333,2015-08-18,Web Development,English,4.0
877036,Sara Learns to Code.  Making an App from Scratch,Paid,60,402,20,35,Beginner,4.0,2016-08-02,Web Development,English,4.0
691760,Ajax  for Beginners: A Very Basic Introduction,Paid,65,755,5,18,Beginner,2.0,2016-01-25,Web Development,English,3.9
579182,Wordpress Essentials: Useful Plugins,Paid,25,1087,7,24,Beginner,1.0,2015-09-15,Web Development,Catalan,4.234613666815543
1071060,Django by Example,Paid,125,170,21,78,Expert,9.0,2017-01-13,Web Development,English,4.234613666815543
235990,Build A Great Wordpress Website For Your Business in 2 Hours,Paid,35,1054,4,26,All Levels,2.0,2014-06-10,Web Development,English,4.234613666815543
469678,Wordpress on AWS: The Easy way to AWS for Free Fast hosting ,Paid,40,245,23,36,All Levels,1.0,2015-08-11,Web Development,English,4.234613666815543
708514,Mastering TypeScript,Paid,95,353,34,41,Expert,3.0,2015-12-29,Web Development,English,4.234613666815543
601260,Mastering AngularJS UI Development,Paid,95,464,26,22,Expert,1.5,2015-09-03,Web Development,English,4.234613666815543
687642,Custom Theme Creation for WordPress using HTML5 and CSS3,Paid,35,298,20,24,Beginner,1.5,2015-12-06,Web Development,English,4.1
654422,Create a PHP Contact Form in Bootstrap,Paid,20,2238,65,12,All Levels,1.0,2015-12-27,Web Development,English,4.6
902748,Introduction To Data Analytics Using Microsoft Power BI,Paid,45,1764,33,16,All Levels,1.5,2016-07-13,Web Development,English,4.3
634754,HTML Made Simple For Beginners: Create a One Page Website,Paid,65,3380,50,16,Beginner,2.0,2015-10-14,Web Development,English,4.3
1112844,The Complete Web Developer Masterclass: Beginner To Advanced,Paid,20,1030,11,30,All Levels,2.5,2017-05-12,Web Development,English,4.234613666815543
1026206,Website Builder Software Previews,Paid,25,1406,12,20,Beginner,1.0,2016-12-15,Web Development,English,4.234613666815543
484872,Learn How to Create Your Own Social Network,Paid,50,4732,5,14,All Levels,2.0,2015-04-24,Web Development,English,4.0
773824,"Learn By Example: The Foundations of HTML, CSS & Javascript",Paid,50,1724,72,94,All Levels,13.0,2016-02-29,Web Development,English,4.6
846578,JavaScript manipulation of the DOM Document Object Model,Paid,20,1618,46,20,Beginner,1.5,2016-05-13,Web Development,English,4.1
358508,Create Jekyll blog and host it on Github like a Ninja,Paid,20,5056,74,11,Beginner,2.0,2014-12-13,Web Development,English,3.5
975060,Learn React JS from scratch,Paid,115,1562,42,34,Beginner,4.0,2016-10-10,Web Development,English,3.3
904818,Web Security: Common Vulnerabilities And Their Mitigation,Paid,50,1547,30,56,All Levels,8.0,2016-07-14,Web Development,English,4.4
472526,PHP for Beginners,Paid,40,2626,95,135,Beginner,6.0,2015-07-01,Web Development,English,4.5
241590,Make a professional website - 30 Day Guarantee. Discounted!,Paid,20,11167,34,13,All Levels,2.0,2014-06-23,Web Development,English,4.1
1182108,Symfony 3: Build a PHP Application with Symfony,Paid,20,466,11,25,All Levels,2.0,2017-04-20,Web Development,English,4.234613666815543
1156648,Learn ASP.Net Web API 2 for Absolute Beginner,Paid,30,1355,14,29,All Levels,3.5,2017-03-30,Web Development,English,4.2
642696,Build a Website in 30 Minutes,Paid,95,5065,40,12,Beginner,0.5333333333333333,2015-11-13,Web Development,English,3.7
1121696,Google Blogger : How to Create a Blog,Paid,20,1763,17,30,Beginner,2.0,2017-02-24,Web Development,English,4.234613666815543
389240,How to Make a Website Without Coding- WordPress & Web Skills,Paid,30,6413,107,123,All Levels,9.0,2015-04-28,Web Development,English,4.5
297044,Learn WCF And Web APIs From Scratch,Paid,50,5398,358,83,Intermediate,10.5,2014-10-08,Web Development,English,4.3
462668,How To Build A Website From Scratch + Blogging Blueprint,Paid,20,7017,37,28,All Levels,3.5,2015-04-08,Web Development,English,3.5
565282,Learn To Create Different Website Layouts & Media Queries ,Paid,195,6510,45,22,All Levels,2.0,2015-08-11,Web Development,English,3.1
1011550,Build Sign Up and Login Forms With Bootstrap Modal,Paid,20,1898,19,31,All Levels,4.0,2016-11-17,Web Development,English,4.2
409618,"Build a Real Time web app in node.js , Angular.js, mongoDB",Paid,20,3299,166,34,All Levels,4.0,2015-03-04,Web Development,English,3.7
1226008,Superb jQuery Course - Become Certified jQuery Developer,Paid,95,817,6,32,All Levels,1.5,2017-05-28,Web Development,English,4.234613666815543
1211960,How To Build A Facebook Messenger Chat Bot From Scratch,Paid,120,1798,20,24,Beginner,1.5,2017-05-11,Web Development,English,4.4
1169848,"Build Your Own Calculator App with Javascript, HTML5 & CSS",Paid,50,3688,49,11,All Levels,1.0,2017-04-13,Web Development,English,4.8
896858,The Complete WordPress Development & Customization Course,Paid,100,1611,165,157,Expert,12.5,2016-11-07,Web Development,English,4.5
696016,HTML CSS Easy steps to create a web template from scratch,Paid,200,11574,78,15,Beginner,1.0,2015-12-14,Web Development,English,4.5
