course_id,course_title,is_paid,price,num_subscribers,num_reviews,num_lectures,level,content_duration,published_timestamp,subject,language,rating
1070968,Ultimate Investment Banking Course,Paid,200,2147,23,51,All Levels,1.5,2017-01-18,Business Finance,English,3.6
1113822,Complete GST Course & Certification - Grow Your CA Practice,Paid,75,2792,923,274,All Levels,39.0,2017-03-09,Business Finance,English,4.5
1006314,Financial Modeling for Business Analysts and Consultants,Paid,45,2174,74,51,Intermediate,2.5,2016-12-19,Business Finance,English,4.2
1210588,Beginner to Pro - Financial Analysis in Excel 2017,Paid,95,2451,11,36,All Levels,3.0,2017-05-30,Business Finance,English,4.5
1011058,How To Maximize Your Profits Trading Options,Paid,200,1276,45,26,Intermediate,2.0,2016-12-13,Business Finance,English,4.8
192870,Trading Penny Stocks: A Guide for All Levels In 2017,Paid,150,9221,138,25,All Levels,3.0,2014-05-02,Business Finance,English,4.234613666815543
739964,Investing And Trading For Beginners: Mastering Price Charts,Paid,65,1540,178,26,Beginner,1.0,2016-02-21,Business Finance,English,4.5
403100,"Trading Stock Chart Patterns For Immediate, Explosive Gains",Paid,95,2917,148,23,All Levels,2.5,2015-01-30,Business Finance,English,4.8
476268,Options Trading 3 : Advanced Stock Profit and Success Method,Paid,195,5172,34,38,Expert,2.5,2015-05-28,Business Finance,English,4.234613666815543
1167710,The Only Investment Strategy You Need For Your Retirement,Paid,200,827,14,15,All Levels,1.0,2017-04-18,Business Finance,English,3.7
592338,Forex Trading Secrets of the Pros With Amazon's AWS,Paid,200,4284,93,76,All Levels,5.0,2015-09-11,Business Finance,English,3.9
975046,Trading Options With Money Flow,Paid,200,1380,42,17,All Levels,1.0,2016-10-18,Business Finance,English,4.234613666815543
742602,Financial Management Risk and Return For Securities,Paid,30,3607,21,19,All Levels,1.5,2016-02-03,Business Finance,English,3.5
794151,Forex Trading Course: Work Smarter Not Harder Proven Results,Paid,195,4061,52,16,All Levels,2.0,2016-03-16,Business Finance,English,4.2
1196544,Python Algo Trading: Sentiment Trading with News,Paid,200,294,19,42,All Levels,7.0,2017-04-28,Business Finance,English,4.234613666815543
504036,Short Selling: Learn To Sell Stocks Before The Fall,Paid,75,2276,106,19,Intermediate,1.5,2015-06-22,Business Finance,English,4.5
719698,Basic Technical Analysis: Learn the structure of the market,Paid,20,4919,79,16,Beginner,1.5,2016-01-08,Business Finance,English,4.234613666815543
564966,The Complete Chart Pattern Trading Course: A Proven Approach,Paid,200,2666,115,52,All Levels,4.0,2015-08-10,Business Finance,English,3.8
606928,7 Deadly Mistakes of Investing that Will Slash Your Profits!,Paid,50,5354,24,23,All Levels,1.5,2015-09-21,Business Finance,English,4.234613666815543
58977,Financial Statements Made Easy,Paid,95,8095,249,12,Beginner,0.5833333333333334,2013-06-09,Business Finance,Catalan,4.234613666815543
1242604,Winning Forex Trading with Live Forex Trading Examples,Paid,200,809,3,25,All Levels,2.0,2017-06-06,Business Finance,English,4.234613666815543
798740,Forex Traders - Create Your First Trading Robot. No Coding!,Paid,200,2295,84,39,All Levels,4.0,2016-05-02,Business Finance,English,4.4
506568,Create A Business From Home Trading Stocks Today In 2017,Paid,75,10149,83,16,All Levels,2.0,2015-05-26,Business Finance,English,4.234613666815543
1020760,Introduction to Accounting : Mastering Financial Statements,Paid,50,1916,38,23,Beginner,1.0,2016-12-05,Business Finance,English,4.5
859742,The Complete Ethereum Course: Get .01 Ether In Your Wallet,Paid,45,2507,333,40,All Levels,2.0,2016-05-30,Business Finance,English,4.234613666815543
383414,Beginner to Pro in PowerPoint: Complete PowerPoint Training,Paid,150,5786,518,50,All Levels,5.0,2015-01-31,Business Finance,English,4.5
353044,Investing 101: The Complete Online Investing Course,Paid,200,5334,373,42,All Levels,4.5,2014-11-28,Business Finance,English,4.3
447362,Create Your Own Hedge Fund: Trade Stocks Like A Fund Manager,Paid,175,4005,237,25,Intermediate,2.0,2015-04-12,Business Finance,English,4.4
831066,Learn MQL5: Build an 8-Currency Hedging Robot (MetaTrader 5),Paid,150,2877,103,81,All Levels,4.5,2016-04-26,Business Finance,English,4.234613666815543
1266306,Forex Trading: Your Complete Guide to Get Started Like a Pro,Paid,140,1026,25,37,Beginner,3.0,2017-06-27,Business Finance,English,4.5
1170894,Python Algo Stock Trading: Automate Your Trading!,Paid,95,1165,21,41,Beginner,2.5,2017-05-28,Business Finance,English,4.234613666815543
948974,THE Forex Robot: Incredible ROI (Robot Included),Paid,200,1843,171,35,All Levels,1.5,2016-10-04,Business Finance,English,3.6
380970,The Complete Bitcoin Course: Get .001 Bitcoin In Your Wallet,Paid,45,8797,449,80,All Levels,6.5,2015-01-09,Business Finance,English,4.5
1217778,Mastering High Probability Iron Condor Options Trading,Paid,200,1030,11,22,All Levels,2.0,2017-06-01,Business Finance,English,4.3
1246208,The Complete Short Course on Ethereum,Paid,200,1041,12,28,All Levels,1.5,2017-06-11,Business Finance,English,3.9
434774,Options Trading Stocks: Proven Toolbox For Financial Success,Paid,195,7884,118,68,Intermediate,10.0,2015-05-19,Business Finance,English,4.0
308690,Forex Trading A-Z™ - With LIVE Examples of Forex Trading,Paid,195,16900,2476,52,Beginner,5.5,2014-12-12,Business Finance,English,4.5
888716,"Introduction to Finance, Accounting, Modeling and Valuation",Paid,200,11441,1118,61,All Levels,4.5,2016-06-28,Business Finance,English,4.5
321410,Beginner to Pro in Excel: Financial Modeling and Valuation,Paid,195,22257,2697,138,All Levels,7.5,2014-11-25,Business Finance,English,4.5
965832,The Complete Investment Banking Course 2017,Paid,195,8575,809,110,All Levels,5.5,2016-10-10,Business Finance,English,4.5
648826,The Complete Financial Analyst Course 2017,Paid,195,24481,2347,174,All Levels,10.0,2016-01-21,Business Finance,English,4.6
1035472,Python for Finance: Investment Fundamentals & Data Analytics,Paid,195,3811,278,103,All Levels,6.5,2017-03-30,Business Finance,English,4.5
1154754,Financial Modeling for Startups & Small Businesses,Paid,195,4991,137,79,Beginner,11.5,2017-03-29,Business Finance,English,4.3
627540,Options Trading - How to Win with Weekly Options,Paid,115,7489,1190,25,Intermediate,1.0,2015-10-22,Business Finance,English,4.4
301442,Black Algo Trading: Build Your Trading Robot,Paid,200,20195,1113,227,All Levels,16.0,2014-10-27,Business Finance,English,4.7
640100,Accounting & Financial Statement Analysis: Complete Training,Paid,150,10042,594,43,All Levels,3.0,2015-10-22,Business Finance,English,4.6
1247394,Cryptocurrency Trading: Complete Guide To Trading Altcoins,Paid,95,367,42,35,All Levels,5.0,2017-06-21,Business Finance,English,4.234613666815543
260470,Forex Robots: Expect To Earn 175% P.A. Forex Robot Included!,Paid,200,10603,872,42,All Levels,5.5,2014-10-12,Business Finance,English,4.4
1214702,Three Steps Trading - Live Trading - Real Account,Paid,190,1197,11,46,All Levels,5.0,2017-05-24,Business Finance,English,3.7
848664,Option Trading for Rookies:  Understand Options Completely,Paid,150,2893,65,62,All Levels,2.0,2016-08-10,Business Finance,English,4.7
1142570,How I Learned Stock Trading (and How You Can Too),Paid,200,1580,12,53,Expert,2.0,2017-05-02,Business Finance,English,3.9
325834,Learn to Trade for Profit: Find and Trade Winning Stocks,Paid,95,10605,71,77,All Levels,3.0,2014-10-24,Business Finance,English,4.5
411168,Trading Inside Bars - Master 1 Easy Pattern To Be Successful,Paid,125,2996,200,23,Intermediate,2.0,2015-03-09,Business Finance,English,4.6
885974,Four Fundamentals of Financial Planning,Paid,30,6219,23,20,All Levels,1.0,2017-02-14,Business Finance,English,3.8
1151092,Options Trading - Calendar Spread Course for Every Trader,Paid,200,1113,11,17,All Levels,1.5,2017-04-02,Business Finance,English,3.8
358326,Dividend Investing: Build Your Portfolio for a Better Future,Paid,60,8314,83,47,Beginner,4.0,2015-01-24,Business Finance,English,4.234613666815543
153210,Learn Accounting. Understand Business.,Paid,200,5572,123,33,Beginner,5.5,2014-03-27,Business Finance,English,4.5
834836,How to Consistently Win Trading Stocks in 30 Days or Less,Paid,145,1433,169,15,Intermediate,1.0,2016-05-09,Business Finance,English,3.9
1171994,A Beginner's Guide to Quantopian Futures API,Paid,20,936,6,11,Intermediate,1.5,2017-04-11,Business Finance,English,4.234613666815543
1239068,How to Buy Cheap Options - Options Trading Pricing Model,Paid,200,658,2,19,All Levels,1.0,2017-06-02,Business Finance,English,4.9
985922,Excel Crash Course: Master Excel for Financial Analysis,Paid,105,8121,689,40,All Levels,3.5,2016-10-18,Business Finance,English,4.6
765562,"Comprehensive Guide to Financial Markets, Investing &Trading",Paid,60,4187,600,79,Beginner,9.0,2016-02-29,Business Finance,English,4.5
165964,Stock Trading Ninja: Complete System For Trading Success,Paid,155,9445,497,38,All Levels,4.5,2014-02-19,Business Finance,English,4.234613666815543
855172,Hedge and Mutual Fund Careers: The Complete Guide,Paid,200,3255,340,102,All Levels,8.5,2016-06-20,Business Finance,English,4.6
258232,Algorithmic Trading In Forex: Create Your First Forex Robot!,Paid,185,7941,713,40,All Levels,6.5,2014-08-11,Business Finance,English,4.5
994754,The Power Modeling Bootcamp: Advanced Excel in 10 Days,Paid,150,1680,158,76,All Levels,5.5,2016-11-26,Business Finance,English,4.6
43319,Options Trading Basics (3-Course Bundle),Paid,180,10100,985,45,Beginner,11.0,2013-02-25,Business Finance,English,4.5
408440,How to Win 97% of Your Options Trades,Paid,125,5050,461,26,All Levels,1.5,2015-02-10,Business Finance,English,4.4
918688,How I Make Consistent Returns Trading Options,Paid,200,2310,162,26,All Levels,3.5,2016-10-05,Business Finance,English,4.7
308694,"Forex Strategies: Kelly Criterion, Larry Williams and more!",Paid,185,5528,506,32,All Levels,3.0,2015-02-19,Business Finance,English,4.4
199450,"Elite Trend Trader: Learn To Trade Stocks, Options & Forex",Paid,125,6451,237,28,All Levels,5.0,2014-04-16,Business Finance,English,4.234613666815543
401784,Options Trading Introduction: Day Trade Stock Options,Paid,95,12394,218,30,Beginner,2.5,2015-02-20,Business Finance,English,3.9
1122792,The Almost Perfect Options Trading Strategy System - Unique,Paid,200,1793,18,15,All Levels,1.0,2017-03-03,Business Finance,English,4.1
709500,Forex Trading -  Learn to Trade Forex Like the Banks,Paid,20,3223,240,23,All Levels,1.0,2016-03-30,Business Finance,English,4.2
285638,Learn to Trade for Profit:Trading with Japanese Candlesticks,Paid,60,16385,273,45,Beginner,3.0,2014-09-02,Business Finance,English,4.6
1135126,The Most Powerful Options Spread Trading Front Ratio Spread,Paid,200,1487,16,18,All Levels,2.0,2017-03-08,Business Finance,English,4.6
834558,What Finance Job is for You? Explanation of 14 Finance Roles,Paid,200,2951,232,60,All Levels,4.0,2016-05-04,Business Finance,English,4.9
551968,The Blueprint for Successful Stock Trading,Paid,120,2697,331,15,All Levels,1.0,2015-08-13,Business Finance,English,4.7
1005658,Trading for Beginners - Intermediate Level,Paid,150,3979,40,39,Beginner,5.0,2016-11-09,Business Finance,English,3.8
746432,Start Trading Stocks Using Technical Analysis!,Paid,25,3190,244,45,All Levels,4.0,2016-02-03,Business Finance,English,4.6
1057242,Learn How to Set Up an Incubator Hedge Fund - Step-by-Step,Paid,200,1406,71,54,Expert,1.5,2017-01-18,Business Finance,English,4.5
284118,VPS for Forex Trading - Protect Your Forex Robots,Paid,160,4252,225,24,All Levels,2.0,2014-09-19,Business Finance,English,4.9
302562,Introduction to Accounting: The Language of Business,Paid,20,11958,370,134,Beginner,11.5,2014-10-02,Business Finance,English,4.8
596598,Basic Excel for Basic Bookkeeping and Accounting,Paid,95,7743,340,33,Beginner,1.5,2015-09-10,Business Finance,English,4.6
860890,"Using 'The Greeks To Understand Options""",Paid,50,2134,55,5,All Levels,1.0,2016-07-13,Business Finance,English,4.1
951050,Trading Options For Consistent Returns: Calendar Spreads,Paid,200,1214,69,20,All Levels,1.5,2016-10-07,Business Finance,English,4.3
796450,How to Create Your Personal Budget,Paid,20,3870,53,10,All Levels,1.0,2016-03-21,Business Finance,English,4.234613666815543
502772,The Complete Value Investing Course: A Proven Approach,Paid,200,2146,212,49,All Levels,4.5,2015-06-16,Business Finance,English,3.9
1102462,FOREX Trading with Price Action,Paid,195,484,57,19,Beginner,1.0,2017-03-14,Business Finance,English,4.4
1062092,Emini ES Futures - Advanced Non Directional Options Trading,Paid,200,1057,15,14,All Levels,1.5,2017-01-11,Business Finance,English,3.7
891484,Forex Trading - Advanced Fundamental Analysis,Paid,20,1754,100,49,Intermediate,2.5,2016-06-30,Business Finance,English,3.6
1217064,How To Invest With Tiny Capital In Stocks ?,Paid,20,1239,5,6,Beginner,0.7,2017-05-23,Business Finance,English,3.4
382204,Learn How To Successfully Trade Stocks: In 5 Simple Steps,Paid,95,2493,276,108,All Levels,9.5,2015-01-31,Business Finance,English,4.1
308696,Forex MetaTrader 4: Master MT4 Like A Pro Forex Trader,Paid,150,2602,402,57,Beginner,5.0,2015-10-28,Business Finance,English,4.7
474928,Intermediate Options trading concepts for Stocks and Options,Paid,40,2000,30,9,All Levels,1.0,2015-04-13,Business Finance,English,4.5
1148774,Options Trading 101: The Basics,Free,0,1514,66,11,Beginner,0.55,2017-03-23,Business Finance,English,4.5
959144,Practical Accounts APP Overview,Paid,20,1361,1,14,Intermediate,3.0,2016-10-04,Business Finance,English,4.234613666815543
1233350,Bitcoin Profits for Beginners,Paid,100,61,18,30,Beginner,1.5,2017-06-09,Business Finance,English,4.234613666815543
572744,Trend Traders Club: How To Find And Trade Fast Moving Trends,Paid,75,1513,31,60,All Levels,5.5,2015-08-04,Business Finance,English,4.234613666815543
724062,Financial Statements Basics,Paid,20,1374,19,9,Beginner,2.0,2016-01-14,Business Finance,English,3.8
474212,High performance Stock Trading using key Options techniques,Paid,40,2103,15,6,All Levels,1.5,2015-04-12,Business Finance,English,4.7
771276,Introduction to Financial Statement Analysis,Paid,20,1480,25,25,Beginner,1.5,2016-03-21,Business Finance,English,4.234613666815543
388164,Basics of Economics (College Level),Paid,25,2516,12,20,All Levels,1.5,2015-01-08,Business Finance,English,4.6
133536,Stock Market Investing for Beginners,Free,0,50855,2698,15,Beginner,1.5,2013-12-25,Business Finance,English,4.4
655300,Accounting for Beginners : Learn Basics in under 1 Hour,Paid,50,1971,13,20,Beginner,1.5,2015-12-03,Business Finance,English,3.4
949504,Straddle Options Trading - Profit in Any Market Direction,Paid,200,837,9,19,All Levels,1.0,2016-10-03,Business Finance,English,4.1
265960,Fundamentals of Forex Trading,Free,0,17160,620,23,All Levels,1.0,2014-08-29,Business Finance,English,4.234613666815543
680044,"Binary Options: Trading Strategies, 90% Accuracy and Signals",Paid,195,1723,38,24,Beginner,1.0,2015-12-14,Business Finance,English,3.8
923616,Website Investing 101 - Buying & Selling Online Businesses,Free,0,6811,151,51,All Levels,2.0,2016-08-05,Business Finance,German,4.234613666815543
741898,Practical Accounts & Bookkeeping Automated Overview ,Paid,20,2060,17,30,All Levels,4.5,2016-01-28,Business Finance,English,4.234613666815543
381330,Live Account - ETF Trading System - Hacking The Stock Market,Paid,150,2318,19,16,All Levels,5.0,2014-12-31,Business Finance,English,4.4
545918,Stock Market Leverage: How to Start Trading Options Wisely,Paid,95,2153,14,13,Beginner,1.5,2015-07-27,Business Finance,English,3.7
191854,Stock Market Foundations,Free,0,19339,794,9,Beginner,2.0,2014-03-31,Business Finance,English,4.6
471546,Crash Course on Working Capital Management,Paid,20,3177,8,8,All Levels,1.0,2015-04-16,Business Finance,English,4.234613666815543
866584,Advanced Accounting A Complete Study for CA / CMA / CFA / CS,Paid,150,1535,16,462,All Levels,62.0,2016-06-03,Business Finance,English,4.3
889824,61% Profit In 1 Month - Crush Your Forex Trading Paradigm,Paid,20,1027,29,25,All Levels,1.5,2016-07-18,Business Finance,English,4.0
1191504,How to create a routine Trading,Paid,25,307,8,5,All Levels,0.1333333333333333,2017-05-01,Business Finance,English,4.234613666815543
585752,"Forex Trading Secrets |MT4 Robot (EA) inside, no coding",Paid,150,2096,48,29,All Levels,0.6833333333333333,2015-08-24,Business Finance,English,4.234613666815543
671578,Forex SOS Course: Trading Tweaks And Working Forex Strategy,Paid,50,1315,48,59,Beginner,2.5,2015-11-18,Business Finance,English,4.2
151668,Introduction to Financial Modeling,Free,0,29167,1463,8,Intermediate,1.5,2014-05-27,Business Finance,English,4.1
1105344,Quantitative Aptitude for Banking & Competitive Examinations,Paid,50,1056,1,42,All Levels,3.0,2017-02-09,Business Finance,English,4.234613666815543
44836,Option Spreads and Credit Spreads Bundle,Paid,180,2212,194,24,Expert,4.5,2013-03-05,Business Finance,English,4.4
840300,B Com Accountancy I (Paper ECO 02 IGNOU),Paid,50,2946,6,284,All Levels,31.5,2016-05-05,Business Finance,English,4.234613666815543
1100054,FOREX TRADING - Learn in a quick + profitable way + support,Paid,100,271,48,47,All Levels,3.5,2017-02-20,Business Finance,English,4.1
421054,Auditing Basics (Professional Course Level),Paid,25,3771,10,35,All Levels,2.5,2015-02-13,Business Finance,English,4.6
528784,Stock market Investing Encyclopedia: How to invest in stocks,Paid,200,3143,11,39,Intermediate,3.0,2015-11-10,Business Finance,English,4.7
637430,Learn the basics of preparing accounting statements,Paid,20,1951,30,20,Intermediate,0.55,2015-10-13,Business Finance,English,4.4
236080,Elliott Wave -Forex Trading With The Elliott Wave Theory,Paid,90,4022,35,14,Expert,1.0,2016-12-15,Business Finance,English,4.234613666815543
777444,Corporate Finance - A Brief Introduction,Free,0,11724,649,17,Beginner,1.5,2016-03-04,Business Finance,English,4.2
474238,Excel functions to analyze and visualize data,Paid,20,2283,54,16,Intermediate,2.0,2015-04-20,Business Finance,English,4.6
1245244,Building Financial Statements in Excel,Paid,35,1181,1,18,Beginner,1.0,2017-06-29,Business Finance,English,4.1
1051570,Transfer Pricing A Complete Analysis,Paid,50,1852,3,14,All Levels,2.5,2016-12-28,Business Finance,English,4.234613666815543
262370,Accounting: Get Hired Without Work Experience,Paid,100,4661,187,20,All Levels,1.0,2014-09-01,Business Finance,English,3.8
1188178,Forex Trading for Beginners - Basics,Paid,50,989,9,11,All Levels,1.0,2017-04-24,Business Finance,English,4.234613666815543
824592,Basic Bookkeeping Hacks,Paid,20,5841,16,28,All Levels,1.5,2016-06-14,Business Finance,English,3.9
1147458,Complete Trading Plan Course for Stocks & Forex (10 Hours),Paid,200,1087,14,61,All Levels,9.5,2017-03-23,Business Finance,English,4.234613666815543
1243448,"Forex Trading with Fixed 'Risk through Options Trading""",Paid,200,611,4,26,Beginner,1.0,2017-06-07,Business Finance,English,4.234613666815543
730414,"Intro to Investment Banking, M&A, IPO, Modeling + Free Book",Paid,60,1922,149,15,All Levels,20.0,2016-01-21,Business Finance,English,4.6
252396,How to Pick The Right Penny Stocks To Invest In 2017,Paid,150,9015,65,23,All Levels,2.5,2014-07-01,Business Finance,English,3.5
1198166,Top 10 Trading Ideas in the Equities Market,Paid,20,661,4,12,All Levels,1.0,2017-05-02,Business Finance,English,4.234613666815543
920604,Intro to Financial Modeling,Paid,105,1077,110,55,Beginner,6.0,2016-08-19,Business Finance,English,4.6
215728,Shark Accounting - Building a Business by the Numbers!,Paid,20,6050,140,17,Beginner,1.5,2014-05-18,Business Finance,English,4.6
722174,Forex Trading MAKE YOUR FIRST TRADE TODAY!,Paid,150,3523,46,45,All Levels,4.0,2016-01-10,Business Finance,English,4.7
48841,Accounting in 60 Minutes - A Brief Introduction,Free,0,56659,4397,16,Beginner,1.5,2013-04-07,Business Finance,English,4.6
907444,SAP FICO For Beginners - A Guide to SAP Financial Accounts,Paid,100,1444,101,59,Beginner,5.0,2016-07-25,Business Finance,English,4.3
317030,Learn how to double your Forex Trading Account in one trade,Paid,60,2900,424,36,Intermediate,2.5,2014-10-19,Business Finance,English,4.3
891490,"Accounting Superpowers: Learn Accounts, Understand Business!",Paid,200,1437,96,34,Beginner,2.5,2016-08-08,Business Finance,English,4.7
1070886,Python Algo Trading: FX Trading with Oanda,Paid,200,453,42,33,Intermediate,3.0,2017-03-14,Business Finance,English,4.234613666815543
812616,Save on Your Taxes,Paid,20,2437,12,23,All Levels,1.5,2016-11-16,Business Finance,English,3.7
407984,Financial Model Basics: Build a model from start to finish,Paid,30,5057,142,13,Beginner,1.0,2015-02-06,Business Finance,English,3.8
214046,Option Trading for Rookies: The Covered Call Option Strategy,Paid,95,6092,25,29,Beginner,1.5,2016-11-03,Business Finance,English,4.234613666815543
512400,EFT for Stock Options Trading Success & Making Better Trades,Paid,95,4530,13,31,All Levels,1.5,2015-08-06,Business Finance,English,4.2
377370,Learn to Trade the Stock Market without Blowing Your Profits,Paid,60,6967,16,34,All Levels,1.0,2017-05-02,Business Finance,English,4.234613666815543
1175694,Get a Credit Repair Publication On Amazon and Live LIFE..,Paid,20,727,11,25,Beginner,3.0,2017-04-26,Business Finance,English,3.8
945750,Fundamentals of Accounting,Paid,20,1560,43,25,All Levels,3.0,2016-08-31,Business Finance,English,4.9
1085580,"RSI, Options Trading & Technical Analysis (3 Course Bundle)",Paid,200,1047,9,46,All Levels,3.5,2017-01-26,Business Finance,English,4.234613666815543
1188410,Basics of Mutual Funds for CA / CMA / CS / CFA Exams,Paid,125,1045,2,17,Intermediate,1.0,2017-04-24,Business Finance,English,4.234613666815543
402836,Accounting 101: How to read an Accounting Balance Sheet,Paid,200,3050,86,22,Beginner,2.0,2015-01-27,Business Finance,English,4.5
588764,Stock Options Day Trading Mindset for Success,Paid,200,2988,21,43,All Levels,4.5,2015-09-29,Business Finance,English,3.8
576946,Introduction to bookkeeping and Accounting,Paid,35,2623,158,20,Beginner,1.0,2015-08-21,Business Finance,English,4.5
543242,Learn to Trade The News,Paid,200,1924,351,544,All Levels,46.5,2015-07-16,Business Finance,English,4.6
502240,"Value Investing, Taught by Six Superinvestors",Paid,200,3804,267,66,All Levels,5.0,2015-06-19,Business Finance,English,3.5
598266,Trading for everyone - The Independent Investor Course I,Paid,120,4133,15,36,Beginner,4.0,2015-10-08,Business Finance,English,3.7
814068,Get Acquired: Learn From The Head Of Acquisitions For eBay,Paid,195,1420,70,29,All Levels,2.5,2016-04-28,Business Finance,English,4.6
1076920,Stock Market investment: Practical Accounting,Paid,125,1120,6,43,Beginner,3.0,2017-01-23,Business Finance,English,3.8
1103272,"How to remove 'Risk from Penny Stocks - Options Trading""",Paid,200,668,12,22,All Levels,1.0,2017-02-07,Business Finance,English,4.8
441112,Accounting Basics in 66 Minutes (absolutely for beginners),Paid,25,4086,31,14,All Levels,1.5,2015-03-08,Business Finance,English,4.234613666815543
1022108,"Tax Accounting: Difficult Topic, Made Easy to Understand",Paid,200,1033,10,29,All Levels,2.0,2017-01-11,Business Finance,English,4.4
1028030,Analysis of Company Financial Statements,Paid,20,832,34,34,All Levels,1.5,2016-12-07,Business Finance,English,3.9
1018380,Forex Trading Like Banks – Step by Step with Live Examples,Paid,195,677,45,40,All Levels,4.5,2016-12-18,Business Finance,English,4.4
575676,Fundamentals of Investing!,Paid,20,3125,54,13,Beginner,2.0,2015-08-09,Business Finance,English,4.5
1105216,Bank Financial Management A Comprehensive Study,Paid,50,1081,6,21,All Levels,1.5,2017-02-10,Business Finance,English,4.234613666815543
936328,Learn to Trade Forex and Stocks: From Beginner to Advanced,Paid,200,1645,25,42,All Levels,2.0,2016-09-07,Business Finance,English,4.234613666815543
43441,"Master 'Technical Analysis and Chart reading skills Bundle""",Paid,120,3348,352,13,All Levels,3.0,2013-02-25,Business Finance,English,4.2
1103718,Naked Put Options Trade Covered Call & Poor Man Covered Call,Paid,200,939,7,19,All Levels,1.5,2017-02-10,Business Finance,English,3.9
584410,The Ultimate Guide to Dividend & Dividend Growth Investing,Paid,200,2115,59,88,All Levels,5.5,2015-11-13,Business Finance,English,4.0
625568,Charting for Beginners 101: Technical Analysis Demystified,Paid,45,2230,102,10,All Levels,1.5,2015-10-09,Business Finance,English,4.6
297742,Build a DCF Valuation Model,Paid,50,2053,234,44,All Levels,5.5,2014-10-01,Business Finance,English,4.5
24877,Introductory Financial Accounting,Paid,80,1793,265,54,Beginner,10.0,2012-10-03,Business Finance,English,4.9
1188742,Introduction to Cryptocurrencies and Blockchain,Free,0,3775,138,11,Beginner,2.0,2017-05-01,Business Finance,English,4.2
597716,Trade Pullback Candlestick Strategy - Make Consistent Pips,Paid,200,521,67,24,All Levels,3.0,2016-02-24,Business Finance,English,3.8
415802,Accounting Standards Basics (Professional Course Level),Paid,20,2222,9,12,All Levels,0.7,2015-02-07,Business Finance,English,4.234613666815543
323950,Use the Magic Multiple Moving Average Forex Trading system,Paid,50,1097,252,10,Intermediate,1.0,2014-11-08,Business Finance,English,4.1
488818,QuickBooks 2015 Training for Newbies,Paid,200,2506,21,76,Beginner,6.0,2015-05-11,Business Finance,English,3.9
610890,TRADING PSYCHOLOGY: Trading Mindset Mastery,Paid,120,975,23,23,Intermediate,1.0,2015-09-30,Business Finance,English,4.0
638980,Option Trading: How to Adjust Delta-Neutral Strangles!,Paid,145,1398,15,26,All Levels,1.5,2015-10-19,Business Finance,English,3.2
599684,Profitable binary option trading strategy,Paid,195,1096,24,24,All Levels,1.5,2015-10-29,Business Finance,English,4.234613666815543
332848,Tax Strategy: Financial Planning for Beginners,Paid,200,1703,59,25,All Levels,2.0,2014-11-04,Business Finance,English,4.3
354324,Accounting 2 Simplified for You,Paid,45,1446,23,27,Beginner,5.0,2014-12-09,Business Finance,English,4.8
